[
  {
    "type": "account",
    "identifier": "Explore Test Co",
    "url": "https://rakesh-freshsales-ind-sep21.myfreshworks.com/crm/sales/accounts/",
    "createdAt": "2026-09-21T21:39:00+05:30",
    "note": "Auto-created via the 'Add contact' form's inline 'Add new account' affordance; resolvable by name via GET /crm/sales/sales_accounts?name=Explore+Test+Co"
  },
  {
    "type": "contact",
    "identifier": "Explore AgentTestLead (explore.agent.testlead@example.com)",
    "url": "https://rakesh-freshsales-ind-sep21.myfreshworks.com/crm/sales/contacts/402219350782",
    "createdAt": "2026-09-21T21:39:30+05:30",
    "note": "Created as the stand-in for a 'Lead' since this tenant has no Leads module enabled for this user role. Lifecycle stage progressed New(Lead) -> Sales Qualified Lead, Status New -> Qualified, to exercise the 'qualify a lead' step."
  },
  {
    "type": "deal",
    "identifier": "Explore Test Co - Pipeline Kanban Test Deal",
    "url": "https://rakesh-freshsales-ind-sep21.myfreshworks.com/crm/sales/deals/402012367593",
    "createdAt": "2026-09-21T21:42:30+05:30",
    "note": "Created from the qualified contact/account, $2,500 value, Default Pipeline. Moved through stages New -> Qualification -> Discovery -> Demo -> Negotiation to exercise the Kanban pipeline movement step. Left at 'Negotiation' (not Won/Lost) since closing a deal is a further irreversible-ish state not required by the scoped feature."
  },
  {
    "type": "task",
    "identifier": "Follow up with Explore Test Co on negotiation terms",
    "url": "https://rakesh-freshsales-ind-sep21.myfreshworks.com/crm/sales/deals/402012367593?tab=recent-activities.tasks",
    "createdAt": "2026-09-21T21:45:29+05:30",
    "note": "Task activity logged against the deal above, due 2026-09-22 16:15, owner Rakesh M, not completed. Exercises the 'log an activity against the deal' step of the target feature."
  }
]
